{
  "v": "ACDCCAACAAJSONAAdn.",
  "t": "acm",
  "d": "EGAIk5DE0z5T0wyluj0sNbYBcRJLHo9tfThlPIkuWEMZ",
  "u": "0ABzZWRpaWRhdHRybm9uYzAw",
  "i": "EP6GqGCzbQ2oI8lk0FryCvP7x1So8LWltKgQJn4Utccv",
  "rd": "EMIRP9uHuZOFV6LVWPTgsAZ0i7xyUTOkN0H6fXMy57lc",
  "s": "EMZtIHLNTVmFfzKXGC1Qvwza37mNqaxLh0bU7zjQyJHS",
  "a": {
    "d": "EJZouL_7J3OmQ-MH5KZDcatioHi-lvNdkCo5gZuEZZjd",
    "u": "0ABzZWRpaWRhdHRybm9uYzAx",
    "i": "EAb0-FaB5Z5lY56-Z8Fb9oArjL2HXhCqDLKfXuYEpdeC",
    "nameGiven": {
      "d": "EA2NOON7bRirXBBah2PWNaJfRnB3-eqVQvL85OS5uWOM",
      "u": "0ABzZWRpaWRhdHRybm9uYzAy",
      "nameGiven": "Alice"
    },
    "nameFamily": {
      "d": "EMOFw7KM2U4ouaBAE0zQ2X6yEUXjNOR4h8_PmbTMblDD",
      "u": "0ABzZWRpaWRhdHRybm9uYzAz",
      "nameFamily": "Anders"
    },
    "dob": {
      "d": "EHyyyL7Ha0iQ2MVxShLnLIklVGHpD4jZFNH3cmYCD3zj",
      "u": "0ABzZWRpaWRhdHRybm9uYzA0",
      "dob": "2000-03-15"
    },
    "image": {
      "d": "EILp3HmVsLx-nW4iYOybZGyXbIyyZ6WdEV1pFmN7ChzV",
      "u": "0ABzZWRpaWRhdHRybm9uYzA1",
      "image": {
        "digest": "EFUio2WoYbqlzROJ4S1f-dq0QUgvpaEutL2Kol-1Av61",
        "format": "image/jpeg",
        "dim": "480x600",
        "captured": "2024-11-03"
      }
    },
    "faceTemplate": {
      "d": "ELBGrvts_EKVm6jw-hiPYsP-wwAL9J56ySLg8Dyt5OQX",
      "u": "0ABzZWRpaWRhdHRybm9uYzA2",
      "faceTemplate": {
        "digest": "EIqN--FwM38xT9wosH0_ObB-xVN-EeZ56fYnP8pCihAX",
        "protocol": "bakobo:biohash:face:v1"
      }
    },
    "residenceStreet": {
      "d": "EMhaZqOWRkS-1ECA8Z7sC4ek_TEcayUesZ-7ajE2-zHm",
      "u": "0ABzZWRpaWRhdHRybm9uYzA3",
      "residenceStreet": "742 Evergreen Terrace"
    },
    "residenceCity": {
      "d": "EOzj_fn_FZNuRAqWJS0RAUnlyhE_suPRnLCTreT3OMYP",
      "u": "0ABzZWRpaWRhdHRybm9uYzA4",
      "residenceCity": "Salt Lake City"
    },
    "residenceState": {
      "d": "EGUyzZEHNNwuHFiy1z5Z1lkj2lZisnm2532-1hVOzP1j",
      "u": "0ABzZWRpaWRhdHRybm9uYzA5",
      "residenceState": "UT"
    },
    "residencePostal": {
      "d": "EHeGeHhjoW8N3eWJmDru4gHrsAgoHvYWj9mCsG4CBylv",
      "u": "0ABzZWRpaWRhdHRybm9uYzEw",
      "residencePostal": "84101"
    },
    "residenceCounty": {
      "d": "EGOxDxxYv3jzSQhQ6Oo1KfXiiq3hbrNhMeodlMpvDMCw",
      "u": "0ABzZWRpaWRhdHRybm9uYzEx",
      "residenceCounty": "Salt Lake"
    }
  },
  "r": "EG8X1nQFCrQ4Rg8BjfE0-BIuKSo1TVbwqymQ3Wuam6VW"
}
